{
  "schema_version": 1,
  "annotation_id": "anotacao-exemplo-primaria",
  "dataset_id": "conjunto-exemplo",
  "dataset_version": "1.0",
  "sample_id": "amostra-exemplo",
  "document_sha256": "0000000000000000000000000000000000000000000000000000000000000000",
  "role": "PRIMARIA",
  "status": "RASCUNHO",
  "annotator_id": "anotador-01",
  "created_at": "2026-07-21T00:00:00-03:00",
  "reviewed_at": null,
  "reviewer_id": null,
  "elements": [
    {
      "id": "poste-001",
      "category": "POSTE",
      "situation": "EXISTENTE",
      "catalog_code": null,
      "page": 1,
      "geometry": {"type": "PONTO", "points": [["0.25", "0.50"]]}
    },
    {
      "id": "estrutura-mt-001",
      "category": "ESTRUTURA_MT",
      "situation": "INSTALAR",
      "catalog_code": "CODIGO-EXEMPLO",
      "page": 1,
      "geometry": {"type": "CAIXA", "points": [["0.23", "0.48"], ["0.27", "0.52"]]}
    }
  ],
  "relations": [
    {
      "id": "relacao-001",
      "source_id": "poste-001",
      "target_id": "estrutura-mt-001",
      "type": "SUPORTA",
      "directed": true
    }
  ]
}
